{
    "uuid": "9097a6c4-2ac8-4959-b544-24cd80fc59df",
    "ai_project_name": "test_project_name_584058",
    "type": null,
    "display_name": null,
    "description": "Project example description",
    "version": "1.0.0",
    "last_update_time": "2025-10-27 10:08:00.613680",
    "creation_time": "2025-10-27 10:08:00.613680",
    "project_owner_uuid": "b5feedda-585f-476d-9e40-52acec908605",
    "models": [
        {
            "uuid": "0c7c60f8-2077-477b-bdf5-07509aeee855",
            "name": "model_example",
            "dataset": {
                "name": "01hy0rzc8jfhk5svwbb9reze42",
                "dataset_id": "01hy0rzc8jfhk5svwbb9reze42"
            },
            "metadata": {
                "type": "classifier",
                "classes": null
            },
            "target": {
                "type": "mlc",
                "component": "lsm6dsv16x",
                "device": "steval-mkboxpro"
            },
            "creation_time": "2025-10-27 10:08:02.150426",
            "last_update_time": "2025-10-27 10:08:02.150435",
            "model_owner_uuid": "b5feedda-585f-476d-9e40-52acec908605"
        }
    ],
    "deployments": [],
    "applications": []
}