{
    "uuid": "da68a1f8-7d33-4654-bc12-939bddc009ba",
    "ai_project_name": "test_project_name_942513",
    "type": null,
    "display_name": null,
    "description": "Project example description",
    "version": "1.0.0",
    "last_update_time": "2025-09-10 10:21:33.979215",
    "creation_time": "2025-09-10 10:21:33.979215",
    "project_owner_uuid": "b5feedda-585f-476d-9e40-52acec908605",
    "models": [
        {
            "uuid": "6967f298-3495-4dcd-a3ce-441b3246b163",
            "name": "model_example",
            "dataset": {
                "name": "01hy0rzc8jfhk5svwbb9reze42",
                "dataset_id": "01hy0rzc8jfhk5svwbb9reze42"
            },
            "metadata": {
                "type": "classifier",
                "classes": null
            },
            "target": {
                "type": "mlc",
                "component": "lsm6dsv16x",
                "device": "steval-mkboxpro"
            },
            "creation_time": "2025-09-10 10:21:35.501758",
            "last_update_time": "2025-09-10 10:21:35.501791",
            "model_owner_uuid": "b5feedda-585f-476d-9e40-52acec908605"
        }
    ],
    "deployments": [],
    "applications": []
}