{
    "uuid": "2403f8d1-929c-4fd1-be40-a82de55c4eea",
    "ai_project_name": "test_project_name_899645",
    "type": null,
    "display_name": null,
    "description": "Project example description",
    "version": "1.0.0",
    "last_update_time": "2025-10-30 13:01:44.111636",
    "creation_time": "2025-10-30 13:01:44.111636",
    "project_owner_uuid": "b5feedda-585f-476d-9e40-52acec908605",
    "models": [
        {
            "uuid": "967f6a24-d833-4647-b13b-c9510595634c",
            "name": "model_example",
            "dataset": {
                "name": "01hy0rzc8jfhk5svwbb9reze42",
                "dataset_id": "01hy0rzc8jfhk5svwbb9reze42"
            },
            "metadata": {
                "type": "classifier",
                "classes": null
            },
            "target": {
                "type": "mlc",
                "component": "lsm6dsv16x",
                "device": "steval-mkboxpro"
            },
            "creation_time": "2025-10-30 13:01:45.421715",
            "last_update_time": "2025-10-30 13:01:45.421723",
            "model_owner_uuid": "b5feedda-585f-476d-9e40-52acec908605"
        }
    ],
    "deployments": [],
    "applications": []
}