{
    "uuid": "545b3727-f640-4321-a9c4-49d050d2bb90",
    "ai_project_name": "test_project_name_661174",
    "type": null,
    "display_name": null,
    "description": "Project example description",
    "version": "1.0.0",
    "last_update_time": "2025-09-11 05:42:43.177773",
    "creation_time": "2025-09-11 05:42:43.177773",
    "project_owner_uuid": "b5feedda-585f-476d-9e40-52acec908605",
    "models": [
        {
            "uuid": "89678ba8-e663-428a-82b1-1b38dd57c893",
            "name": "model_example",
            "dataset": {
                "name": "01hy0rzc8jfhk5svwbb9reze42",
                "dataset_id": "01hy0rzc8jfhk5svwbb9reze42"
            },
            "metadata": {
                "type": "classifier",
                "classes": null
            },
            "target": {
                "type": "mlc",
                "component": "lsm6dsv16x",
                "device": "steval-mkboxpro"
            },
            "creation_time": "2025-09-11 05:42:44.501797",
            "last_update_time": "2025-09-11 05:42:44.501805",
            "model_owner_uuid": "b5feedda-585f-476d-9e40-52acec908605"
        }
    ],
    "deployments": [],
    "applications": []
}