{
    "uuid": "6419fe73-57ef-4cdb-889e-2fd2e18c3696",
    "ai_project_name": "test_project_name_944349",
    "type": null,
    "display_name": null,
    "description": "Project example description",
    "version": "1.0.0",
    "last_update_time": "2025-12-17 09:31:04.027269",
    "creation_time": "2025-12-17 09:31:04.027269",
    "project_owner_uuid": "b5feedda-585f-476d-9e40-52acec908605",
    "models": [
        {
            "uuid": "682ac5e8-369c-4130-8f92-da63b27e1b8d",
            "name": "model_example",
            "dataset": {
                "name": "01hy0rzc8jfhk5svwbb9reze42",
                "dataset_id": "01hy0rzc8jfhk5svwbb9reze42"
            },
            "metadata": {
                "type": "classifier",
                "classes": null
            },
            "target": {
                "type": "mlc",
                "component": "lsm6dsv16x",
                "device": "steval-mkboxpro"
            },
            "creation_time": "2025-12-17 09:31:05.414694",
            "last_update_time": "2025-12-17 09:31:05.414701",
            "model_owner_uuid": "b5feedda-585f-476d-9e40-52acec908605"
        }
    ],
    "deployments": [],
    "applications": []
}