{
    "uuid": "bd8ab433-b2cd-497b-a4ec-3632cc333c42",
    "ai_project_name": "test_project_name_228004",
    "type": null,
    "display_name": null,
    "description": "Project example description",
    "version": "1.0.0",
    "last_update_time": "2025-09-05 12:49:44.557357",
    "creation_time": "2025-09-05 12:49:44.557357",
    "project_owner_uuid": "b5feedda-585f-476d-9e40-52acec908605",
    "models": [
        {
            "uuid": "0902e7e9-8f3b-4afd-a2a4-c0de1d67f7d7",
            "name": "model_example",
            "dataset": {
                "name": "01hy0rzc8jfhk5svwbb9reze42",
                "dataset_id": "01hy0rzc8jfhk5svwbb9reze42"
            },
            "metadata": {
                "type": "classifier",
                "classes": null
            },
            "target": {
                "type": "mlc",
                "component": "lsm6dsv16x",
                "device": "steval-mkboxpro"
            },
            "creation_time": "2025-09-05 12:49:45.951268",
            "last_update_time": "2025-09-05 12:49:45.951276",
            "model_owner_uuid": "b5feedda-585f-476d-9e40-52acec908605"
        }
    ],
    "deployments": [],
    "applications": []
}